{
 "schema": "x402-conformance.case/1",
 "tool_version": "1.4.0",
 "via": "pytest",
 "kind": "resource-402",
 "target": "redacted",
 "stack": {
  "framework": "hono at <url>",
  "sdk": "@x402/hono",
  "sdk_version": "2.28.0",
  "network": "solana:EtWTRABZaYq6iMfeYKouRu166VU2xqa1"
 },
 "failed_ids": [
  "P4",
  "P5"
 ],
 "results": [
  {
   "id": "P1",
   "check": "P1 an unpaid GET answers HTTP 402 (V2 HTTP transport)",
   "status": "pass",
   "severity": "error",
   "detail": null
  },
  {
   "id": "P4",
   "check": "P4 every accepts[] entry has the required fields with valid types (V2 5.1.2; V1 5.1)",
   "status": "fail",
   "severity": "error",
   "detail": {
    "accepts": 2,
    "problems": [
     {
      "index": 0,
      "scheme": "exact",
      "network": "eip155:84532",
      "problems": [
       "amount must be a string of atomic units greater than 0"
      ]
     }
    ]
   }
  },
  {
   "id": "P5",
   "check": "P5 scheme-specific extra fields are present (EVM exact: name and version; SVM exact: feePayer)",
   "status": "fail",
   "severity": "error",
   "detail": {
    "problems": [
     {
      "index": 1,
      "network": "solana:EtWTRABZaYq6iMfeYKouRu166VU2xqa1",
      "payTo": "<redacted>",
      "note": "seen at <url> from <ip> paying <hex> on <host> with 4zMMC9srt5Ri5X14GAgXhaHii3GnPAEERYPJgZJDncDU",
      "deep": {
       "a": {
        "b": {
         "c": {
          "d": {
           "e": {
            "f": "<truncated>"
           }
          }
         }
        }
       }
      },
      "list": [
       1,
       2,
       3,
       4,
       5,
       6,
       7,
       8,
       9,
       10
      ]
     }
    ]
   }
  },
  {
   "id": "R0",
   "check": "R0 unpaid request: 402 with a PAYMENT-REQUIRED header offering a network the probe grades",
   "status": "unsupported",
   "severity": "error",
   "detail": {
    "accepts": [
     [
      "exact",
      "eip155:1"
     ]
    ]
   }
  }
 ]
}
